{"$id":"https://github.com/martin-beck/agent-workflow-quality/schemas/android-jvm-policy.schema.json","$schema":"https://json-schema.org/draft/2020-12/schema","additionalProperties":false,"properties":{"device":{"additionalProperties":false,"properties":{"abi":{"enum":["arm64-v8a","x86_64"]},"api_level":{"maximum":100,"minimum":28,"type":"integer"},"form_factor":{"enum":["phone","tablet","wear"]},"image_sha256":{"pattern":"^[0-9a-f]{64}$","type":"string"},"locale":{"pattern":"^[a-z]{2}(?:-[A-Z]{2})?$","type":"string"},"max_age_hours":{"maximum":168,"minimum":1,"type":"integer"},"minimum_executed":{"maximum":1000000,"minimum":1,"type":"integer"},"minimum_tests":{"maximum":1000000,"minimum":1,"type":"integer"},"observation_path":{"minLength":1,"type":"string"},"report_glob":{"minLength":1,"type":"string"},"required_modules":{"items":{"pattern":"^[A-Za-z0-9_.-]+(?:/[A-Za-z0-9_.-]+)*$","type":"string"},"maxItems":100,"minItems":1,"type":"array","uniqueItems":true}},"required":["abi","api_level","form_factor","image_sha256","locale","max_age_hours","minimum_executed","minimum_tests","observation_path","report_glob","required_modules"],"type":"object"},"integrity":{"additionalProperties":false,"properties":{"allowed_repositories":{"items":{"enum":["google","gradlePluginPortal","mavenCentral"]},"maxItems":3,"minItems":1,"type":"array","uniqueItems":true},"files":{"items":{"additionalProperties":false,"properties":{"path":{"pattern":"^(?!/)(?!.*(?:^|/)\\.\\.(?:/|$))(?!.*\\\\\\\\).+$","type":"string"},"sha256":{"pattern":"^[0-9a-f]{64}$","type":"string"}},"required":["path","sha256"],"type":"object"},"maxItems":1000,"minItems":5,"type":"array"},"locks":{"items":{"additionalProperties":false,"properties":{"path":{"pattern":"^(?!/)(?!.*(?:^|/)\\.\\.(?:/|$))(?!.*\\\\\\\\).+$","type":"string"},"sha256":{"pattern":"^[0-9a-f]{64}$","type":"string"}},"required":["path","sha256"],"type":"object"},"maxItems":1000,"minItems":1,"type":"array"}},"required":["allowed_repositories","files","locks"],"type":"object"},"resources":{"additionalProperties":false,"properties":{"cpu_seconds":{"maximum":3600,"minimum":1,"type":"integer"},"file_size_mib":{"maximum":4096,"minimum":1,"type":"integer"},"memory_mib":{"maximum":16384,"minimum":256,"type":"integer"},"open_files":{"maximum":4096,"minimum":64,"type":"integer"},"outer_timeout_seconds":{"maximum":3600,"minimum":1,"type":"integer"},"tracked_file_limit":{"maximum":100000,"minimum":1,"type":"integer"},"tracked_mib":{"maximum":4096,"minimum":1,"type":"integer"}},"required":["cpu_seconds","file_size_mib","memory_mib","open_files","outer_timeout_seconds","tracked_file_limit","tracked_mib"],"type":"object"},"schema_version":{"const":1},"tasks":{"additionalProperties":false,"properties":{"abi":{"items":{"pattern":"^(?::[A-Za-z0-9_.-]+)*:[A-Za-z][A-Za-z0-9]*$|^[A-Za-z][A-Za-z0-9]*$","type":"string"},"maxItems":50,"minItems":1,"type":"array","uniqueItems":true},"android-build":{"items":{"pattern":"^(?::[A-Za-z0-9_.-]+)*:[A-Za-z][A-Za-z0-9]*$|^[A-Za-z][A-Za-z0-9]*$","type":"string"},"maxItems":50,"minItems":1,"type":"array","uniqueItems":true},"android-lint":{"items":{"pattern":"^(?::[A-Za-z0-9_.-]+)*:[A-Za-z][A-Za-z0-9]*$|^[A-Za-z][A-Za-z0-9]*$","type":"string"},"maxItems":50,"minItems":1,"type":"array","uniqueItems":true},"coverage":{"items":{"pattern":"^(?::[A-Za-z0-9_.-]+)*:[A-Za-z][A-Za-z0-9]*$|^[A-Za-z][A-Za-z0-9]*$","type":"string"},"maxItems":50,"minItems":1,"type":"array","uniqueItems":true},"dependency":{"items":{"pattern":"^(?::[A-Za-z0-9_.-]+)*:[A-Za-z][A-Za-z0-9]*$|^[A-Za-z][A-Za-z0-9]*$","type":"string"},"maxItems":50,"minItems":1,"type":"array","uniqueItems":true},"format":{"items":{"pattern":"^(?::[A-Za-z0-9_.-]+)*:[A-Za-z][A-Za-z0-9]*$|^[A-Za-z][A-Za-z0-9]*$","type":"string"},"maxItems":50,"minItems":1,"type":"array","uniqueItems":true},"static":{"items":{"pattern":"^(?::[A-Za-z0-9_.-]+)*:[A-Za-z][A-Za-z0-9]*$|^[A-Za-z][A-Za-z0-9]*$","type":"string"},"maxItems":50,"minItems":1,"type":"array","uniqueItems":true},"test":{"items":{"pattern":"^(?::[A-Za-z0-9_.-]+)*:[A-Za-z][A-Za-z0-9]*$|^[A-Za-z][A-Za-z0-9]*$","type":"string"},"maxItems":50,"minItems":1,"type":"array","uniqueItems":true}},"required":["abi","android-build","android-lint","coverage","dependency","format","static","test"],"type":"object"},"toolchain":{"additionalProperties":false,"properties":{"agp_version":{"const":"9.0.1"},"gradle_distribution_sha256":{"pattern":"^[0-9a-f]{64}$","type":"string"},"gradle_version":{"const":"9.1.0"},"host":{"const":"x86_64-unknown-linux-gnu"},"java_version":{"const":"17.0.20.1"},"kotlin_version":{"const":"2.3.20"},"wrapper_jar_sha256":{"pattern":"^[0-9a-f]{64}$","type":"string"}},"required":["agp_version","gradle_distribution_sha256","gradle_version","host","java_version","kotlin_version","wrapper_jar_sha256"],"type":"object"}},"required":["device","integrity","resources","schema_version","tasks","toolchain"],"title":"AWQ Android and JVM assurance policy","type":"object"}
