{"device":{"abi":"x86_64","api_level":36,"form_factor":"phone","image_sha256":"2222222222222222222222222222222222222222222222222222222222222222","locale":"en-US","max_age_hours":24,"minimum_executed":1,"minimum_tests":1,"observation_path":"build/awq/device-observation.json","report_glob":"*/build/outputs/androidTest-results/**/*.xml","required_modules":["app"]},"integrity":{"allowed_repositories":["google","gradlePluginPortal","mavenCentral"],"files":[{"path":"gradle/libs.versions.toml","sha256":"1111111111111111111111111111111111111111111111111111111111111111"},{"path":"gradle/verification-metadata.xml","sha256":"1111111111111111111111111111111111111111111111111111111111111111"},{"path":"gradle/wrapper/gradle-wrapper.jar","sha256":"1111111111111111111111111111111111111111111111111111111111111111"},{"path":"gradle/wrapper/gradle-wrapper.properties","sha256":"1111111111111111111111111111111111111111111111111111111111111111"},{"path":"settings.gradle.kts","sha256":"1111111111111111111111111111111111111111111111111111111111111111"}],"locks":[{"path":"app/gradle.lockfile","sha256":"3333333333333333333333333333333333333333333333333333333333333333"}]},"resources":{"cpu_seconds":900,"file_size_mib":512,"memory_mib":4096,"open_files":1024,"outer_timeout_seconds":1200,"tracked_file_limit":20000,"tracked_mib":1024},"schema_version":1,"tasks":{"abi":["awqAbi"],"android-build":["awqAndroidBuild"],"android-lint":["awqAndroidLint"],"coverage":["awqCoverage"],"dependency":["awqDependency"],"format":["awqFormat"],"static":["awqStatic"],"test":["awqTest"]},"toolchain":{"agp_version":"9.0.1","gradle_distribution_sha256":"a17ddd85a26b6a7f5ddb71ff8b05fc5104c0202c6e64782429790c933686c806","gradle_version":"9.1.0","host":"x86_64-unknown-linux-gnu","java_version":"17.0.20.1","kotlin_version":"2.3.20","wrapper_jar_sha256":"4444444444444444444444444444444444444444444444444444444444444444"}}
